{
  "agent": "Verifier",
  "run_id": "moises-harmony-skill-20261031",
  "timestamp": "2026-10-31T07:33:02.265334+00:00",
  "status": "success",
  "summary": "Independent read-only applications passed four realistic harmony cases with no actionable issues.",
  "blocking": false,
  "needs_human": false,
  "output": {
    "reviewer": "/root/retire_chord_skill/harmony_forward_review",
    "method": "Independent agent read new skill and reference; received user-like input only, without expected answers; no file edits, external sources or application mutations.",
    "cases": [
      {
        "input": "Moises A장조, F#m → C#7 → D → A, excerpt only; modal interchange?",
        "observed_behavior": "Preserved order; vi–V7/vi–IV–I versus i–V7–VI–III alternatives; expected F#m distinguished from actual D; no modal borrowing established; no confirmed cadence."
      },
      {
        "input": "Moises export Demo, C key, bars 1–4 C F Fm C.",
        "observed_behavior": "Identified I–IV–iv–I; parallel C-natural-minor borrowed iv via Ab; possible A–Ab–G voice leading labeled possible, not observed."
      },
      {
        "input": "Moises screenshot text Dm G7 C A7 Dm G7 C, displayed C; no bar/phrase metadata.",
        "observed_behavior": "Identified ii–V7–I–V7/ii–ii–V7–I; A7 targets actual following Dm; no forced borrowing, modulation or cadence."
      },
      {
        "input": "John Lennon Oh My Love 코드 분석해줘, no result and no app access.",
        "observed_behavior": "Requested relevant Moises chart/export rather than filling chords from song memory."
      }
    ]
  },
  "issues": []
}
